{"$id":"https://example.invalid/anki-study-report/core-economy-evaluation-pipeline-v3.schema.json","$schema":"https://json-schema.org/draft/2020-12/schema","additionalProperties":false,"properties":{"$schema":{"type":"string"},"identity":{"additionalProperties":false,"properties":{"artifact_digest":{"pattern":"^[0-9a-f]{64}$","type":"string"},"artifact_id":{"const":"core-economy-evaluation-pipeline"},"digest_scope":{"minLength":1,"type":"string"},"generator_version":{"type":"string"},"stage":{"type":"string"},"status":{"const":"FROZEN_PRE_SCREENING"},"validator_version":{"type":"string"},"version":{"const":3}},"required":["artifact_id","version","status","artifact_digest","digest_scope"],"type":"object"},"numeric_policy":{"additionalProperties":false,"properties":{"decimal_places":{"type":"integer"},"epsilon":{"type":"number"},"negative_contribution":{"type":"string"},"nonfinite":{"type":"string"},"rounding_mode":{"type":"string"}},"required":["epsilon","rounding_mode","decimal_places","nonfinite","negative_contribution"],"type":"object"},"operator_order_resolution":{"additionalProperties":false,"properties":{"nonlinear_reference_operator":{"type":"string"},"prohibited_expression":{"type":"string"},"rationale":{"type":"string"},"selected":{"type":"string"},"selected_expression":{"type":"string"}},"required":["selected","selected_expression","prohibited_expression","nonlinear_reference_operator","rationale"],"type":"object"},"production_flags":{"additionalProperties":false,"properties":{"g4_4_started":{"type":"boolean"},"production_approved":{"type":"boolean"},"production_integration":{"type":"boolean"},"screening_executed":{"type":"boolean"},"simulation_started":{"type":"boolean"}},"required":["screening_executed","simulation_started","g4_4_started","production_approved","production_integration"],"type":"object"},"state_policy":{"additionalProperties":false,"properties":{"level_loss_allowed":{"type":"boolean"},"past_progression_mutation":{"type":"boolean"},"read_before_transition":{"type":"boolean"},"write_after_step":{"type":"boolean"},"xp_debt_allowed":{"type":"boolean"}},"required":["read_before_transition","write_after_step","past_progression_mutation","level_loss_allowed","xp_debt_allowed"],"type":"object"},"steps":{"items":{"anyOf":[{"additionalProperties":false,"properties":{"candidate_dimension":{"type":"string"},"fail_closed_reason":{"type":"string"},"input_type":{"type":"string"},"missing_data_behavior":{"type":"string"},"ordinal":{"type":"integer"},"output_type":{"type":"string"},"reason_codes":{"items":{"type":"string"},"maxItems":2,"minItems":2,"type":"array"},"rounding":{"additionalProperties":false,"properties":{"apply_at":{"type":"string"},"decimal_places":{"type":"integer"},"mode":{"type":"string"}},"required":["mode","decimal_places","apply_at"],"type":"object"},"state_read_timing":{"type":"string"},"state_write_timing":{"type":"string"},"step_id":{"type":"string"}},"required":["ordinal","step_id","input_type","output_type","candidate_dimension","rounding","state_read_timing","state_write_timing","missing_data_behavior","fail_closed_reason","reason_codes"],"type":"object"},{"additionalProperties":false,"properties":{"candidate_dimension":{"type":"string"},"fail_closed_reason":{"type":"string"},"input_type":{"type":"string"},"missing_data_behavior":{"type":"string"},"ordinal":{"type":"integer"},"output_type":{"type":"string"},"reason_codes":{"items":{"type":"string"},"maxItems":3,"minItems":3,"type":"array"},"rounding":{"additionalProperties":false,"properties":{"apply_at":{"type":"string"},"decimal_places":{"type":"integer"},"mode":{"type":"string"}},"required":["mode","decimal_places","apply_at"],"type":"object"},"state_read_timing":{"type":"string"},"state_write_timing":{"type":"string"},"step_id":{"type":"string"}},"required":["ordinal","step_id","input_type","output_type","candidate_dimension","rounding","state_read_timing","state_write_timing","missing_data_behavior","fail_closed_reason","reason_codes"],"type":"object"},{"additionalProperties":false,"properties":{"candidate_dimension":{"type":"string"},"fail_closed_reason":{"type":"string"},"input_type":{"type":"string"},"missing_data_behavior":{"type":"string"},"ordinal":{"type":"integer"},"output_type":{"type":"string"},"reason_codes":{"items":{"type":"string"},"maxItems":1,"minItems":1,"type":"array"},"rounding":{"additionalProperties":false,"properties":{"apply_at":{"type":"string"},"decimal_places":{"type":"integer"},"mode":{"type":"string"}},"required":["mode","decimal_places","apply_at"],"type":"object"},"state_read_timing":{"type":"string"},"state_write_timing":{"type":"string"},"step_id":{"type":"string"}},"required":["ordinal","step_id","input_type","output_type","candidate_dimension","rounding","state_read_timing","state_write_timing","missing_data_behavior","fail_closed_reason","reason_codes"],"type":"object"}]},"maxItems":17,"minItems":17,"type":"array"},"uncertainty_state_machine":{"additionalProperties":false,"properties":{"affected_component":{"type":"string"},"bonus_multiplier_allowed":{"type":"boolean"},"debt_allowed":{"type":"boolean"},"evidence_window":{"additionalProperties":false,"properties":{"invalid_signal_behavior":{"type":"string"},"kind":{"type":"string"},"missing_signal_behavior":{"type":"string"},"size":{"type":"integer"}},"required":["kind","size","invalid_signal_behavior","missing_signal_behavior"],"type":"object"},"initial_state":{"type":"string"},"past_progression_mutation":{"type":"boolean"},"signals":{"items":{"type":"string"},"maxItems":4,"minItems":4,"type":"array"},"states":{"items":{"type":"string"},"maxItems":4,"minItems":4,"type":"array"},"transition_table":{"items":{"additionalProperties":false,"properties":{"applied_multiplier":{"type":"number"},"current_state":{"type":"string"},"missing_evidence_behavior":{"type":"string"},"multiplier_apply_timing":{"type":"string"},"next_state":{"type":"string"},"predicate":{"additionalProperties":false,"properties":{"op":{"type":"string"}},"required":["op"],"type":"object"},"reason_code":{"type":"string"},"recent_evidence_window":{"additionalProperties":false,"properties":{"includes_current":{"type":"boolean"},"kind":{"type":"string"},"size":{"type":"integer"}},"required":["kind","size","includes_current"],"type":"object"},"signal":{"type":"string"},"state_read_timing":{"type":"string"},"state_write_timing":{"type":"string"}},"required":["current_state","signal","recent_evidence_window","predicate","next_state","applied_multiplier","state_read_timing","multiplier_apply_timing","state_write_timing","reason_code","missing_evidence_behavior"],"type":"object"},"maxItems":18,"minItems":18,"type":"array"},"unaffected_components":{"items":{"type":"string"},"maxItems":2,"minItems":2,"type":"array"}},"required":["initial_state","states","signals","affected_component","unaffected_components","transition_table","evidence_window","past_progression_mutation","debt_allowed","bonus_multiplier_allowed"],"type":"object"}},"required":["$schema","identity","operator_order_resolution","numeric_policy","steps","state_policy","uncertainty_state_machine","production_flags"],"type":"object"}
