{"$schema":"../schemas/core-economy-evaluation-pipeline-v3.schema.json","identity":{"artifact_digest":"1f8d3cfe8d60b1ac7e2a8f0dd27808b8c28d448f90ab02fe947d9c3c68720001","artifact_id":"core-economy-evaluation-pipeline","digest_scope":"CANONICAL_ARTIFACT_EXCLUDING_IDENTITY_DIGEST","generator_version":"core-economy-protocol-v3-generator-1","status":"FROZEN_PRE_SCREENING","validator_version":"core-economy-protocol-v3-validator-1","version":3},"numeric_policy":{"decimal_places":12,"epsilon":1e-12,"negative_contribution":"REJECT","nonfinite":"REJECT","rounding_mode":"ROUND_HALF_EVEN"},"operator_order_resolution":{"nonlinear_reference_operator":"log1p(3*x)/log1p(3*anchor)","prohibited_expression":"normalize(verified_base + positive_context) then taper normalized aggregate","rationale":"Uncertainty may affect only positive context; aggregate-first nonlinear normalization would leak taper into verified base.","selected":"NORMALIZE_COMPONENTS_SEPARATELY_AFTER_UNCERTAINTY","selected_expression":"normalize(verified_base) + normalize(taper(positive_context)) + normalize(negative_context)"},"production_flags":{"g4_4_started":false,"production_approved":false,"production_integration":false,"screening_executed":false,"simulation_started":false},"state_policy":{"level_loss_allowed":false,"past_progression_mutation":false,"read_before_transition":true,"write_after_step":true,"xp_debt_allowed":false},"steps":[{"candidate_dimension":"NONE","fail_closed_reason":"FAIL_CLOSED_INVALID_SOURCE","input_type":"SOURCE_RECORD_BATCH","missing_data_behavior":"FAIL_CLOSED_INVALID_SOURCE","ordinal":1,"output_type":"VALIDATED_SOURCE_RECORD_BATCH","reason_codes":["RC-SOURCE-VALID","RC-SOURCE-REJECTED"],"rounding":{"apply_at":"STEP_OUTPUT","decimal_places":12,"mode":"ROUND_HALF_EVEN"},"state_read_timing":"BEFORE","state_write_timing":"NONE","step_id":"S01-SOURCE-VALIDATION"},{"candidate_dimension":"REVIEW_MODEL_AXIS_V1","fail_closed_reason":"FAIL_CLOSED_SOURCE_MODEL","input_type":"VALIDATED_SOURCE_RECORD_BATCH","missing_data_behavior":"FAIL_CLOSED_SOURCE_MODEL","ordinal":2,"output_type":"SOURCE_TRANSITION_BATCH","reason_codes":["RC-REVIEW-STEP","RC-REVIEW-TAPER","RC-LEARN-CONFIRMATION"],"rounding":{"apply_at":"STEP_OUTPUT","decimal_places":12,"mode":"ROUND_HALF_EVEN"},"state_read_timing":"BEFORE","state_write_timing":"AFTER","step_id":"S02-SOURCE-MODEL-TRANSITION"},{"candidate_dimension":"NONE","fail_closed_reason":"FAIL_CLOSED_DECOMPOSITION","input_type":"SOURCE_TRANSITION_BATCH","missing_data_behavior":"FAIL_CLOSED_DECOMPOSITION","ordinal":3,"output_type":"COMPONENT_BATCH","reason_codes":["RC-VERIFIED-BASE","RC-POSITIVE-CONTEXT","RC-NEGATIVE-CONTEXT"],"rounding":{"apply_at":"STEP_OUTPUT","decimal_places":12,"mode":"ROUND_HALF_EVEN"},"state_read_timing":"BEFORE","state_write_timing":"NONE","step_id":"S03-DECOMPOSE-BASE-CONTEXT"},{"candidate_dimension":"UNCERTAINTY_RESPONSE","fail_closed_reason":"MISSING_EVIDENCE_HOLDS_STATE","input_type":"COMPONENT_BATCH","missing_data_behavior":"MISSING_EVIDENCE_HOLDS_STATE","ordinal":4,"output_type":"COMPONENT_WITH_STATE_BATCH","reason_codes":["RC-UNCERTAINTY-STATE-READ"],"rounding":{"apply_at":"STEP_OUTPUT","decimal_places":12,"mode":"ROUND_HALF_EVEN"},"state_read_timing":"BEFORE","state_write_timing":"NONE","step_id":"S04-READ-UNCERTAINTY-STATE"},{"candidate_dimension":"UNCERTAINTY_RESPONSE","fail_closed_reason":"FAIL_CLOSED_POSITIVE_CONTEXT_ONLY","input_type":"COMPONENT_WITH_STATE_BATCH","missing_data_behavior":"FAIL_CLOSED_POSITIVE_CONTEXT_ONLY","ordinal":5,"output_type":"TAPERED_COMPONENT_BATCH","reason_codes":["RC-CONTEXT-TAPERED","RC-VERIFIED-BASE-UNCHANGED"],"rounding":{"apply_at":"STEP_OUTPUT","decimal_places":12,"mode":"ROUND_HALF_EVEN"},"state_read_timing":"BEFORE","state_write_timing":"AFTER","step_id":"S05-APPLY-UNCERTAINTY"},{"candidate_dimension":"CROSS_DOMAIN_CONVERSION","fail_closed_reason":"FAIL_CLOSED_NORMALIZATION","input_type":"TAPERED_COMPONENT_BATCH","missing_data_behavior":"FAIL_CLOSED_NORMALIZATION","ordinal":6,"output_type":"NORMALIZED_COMPONENT_BATCH","reason_codes":["RC-COMPONENTWISE-NORMALIZED"],"rounding":{"apply_at":"STEP_OUTPUT","decimal_places":12,"mode":"ROUND_HALF_EVEN"},"state_read_timing":"BEFORE","state_write_timing":"NONE","step_id":"S06-DOMAIN-NORMALIZATION"},{"candidate_dimension":"NONE","fail_closed_reason":"FAIL_CLOSED_DOMAIN_AGGREGATION","input_type":"NORMALIZED_COMPONENT_BATCH","missing_data_behavior":"FAIL_CLOSED_DOMAIN_AGGREGATION","ordinal":7,"output_type":"DOMAIN_DAILY_PREBOUND","reason_codes":["RC-REVIEW-AGGREGATED","RC-LEARN-AGGREGATED"],"rounding":{"apply_at":"STEP_OUTPUT","decimal_places":12,"mode":"ROUND_HALF_EVEN"},"state_read_timing":"BEFORE","state_write_timing":"NONE","step_id":"S07-PER-DOMAIN-AGGREGATION"},{"candidate_dimension":"DAILY_BOUNDING","fail_closed_reason":"FAIL_CLOSED_DAILY_BOUNDING","input_type":"DOMAIN_DAILY_PREBOUND","missing_data_behavior":"FAIL_CLOSED_DAILY_BOUNDING","ordinal":8,"output_type":"DOMAIN_DAILY_BOUNDED","reason_codes":["RC-REVIEW-BOUNDED","RC-LEARN-BOUNDED"],"rounding":{"apply_at":"STEP_OUTPUT","decimal_places":12,"mode":"ROUND_HALF_EVEN"},"state_read_timing":"BEFORE","state_write_timing":"NONE","step_id":"S08-PER-DOMAIN-DAILY-BOUNDING"},{"candidate_dimension":"CROSS_DOMAIN_CONVERSION","fail_closed_reason":"FAIL_CLOSED_CONVERSION","input_type":"DOMAIN_DAILY_BOUNDED","missing_data_behavior":"FAIL_CLOSED_CONVERSION","ordinal":9,"output_type":"WEIGHTED_DOMAIN_CONTRIBUTION","reason_codes":["RC-REVIEW-WEIGHTED","RC-LEARN-WEIGHTED"],"rounding":{"apply_at":"STEP_OUTPUT","decimal_places":12,"mode":"ROUND_HALF_EVEN"},"state_read_timing":"BEFORE","state_write_timing":"NONE","step_id":"S09-CROSS-DOMAIN-CONVERSION"},{"candidate_dimension":"DAILY_BOUNDING","fail_closed_reason":"NO_GLOBAL_ENVELOPE_FOR_RECOMMENDATION_CANDIDATES","input_type":"WEIGHTED_DOMAIN_CONTRIBUTION","missing_data_behavior":"NO_GLOBAL_ENVELOPE_FOR_RECOMMENDATION_CANDIDATES","ordinal":10,"output_type":"FINAL_DAILY_CONTRIBUTION","reason_codes":["RC-NO-GLOBAL-ENVELOPE","RC-CONTROL-GLOBAL-CAP"],"rounding":{"apply_at":"STEP_OUTPUT","decimal_places":12,"mode":"ROUND_HALF_EVEN"},"state_read_timing":"BEFORE","state_write_timing":"NONE","step_id":"S10-OPTIONAL-GLOBAL-ENVELOPE"},{"candidate_dimension":"PRODUCTIVE_DAY","fail_closed_reason":"FAIL_CLOSED_CLASSIFICATION","input_type":"FINAL_DAILY_CONTRIBUTION","missing_data_behavior":"FAIL_CLOSED_CLASSIFICATION","ordinal":11,"output_type":"PRODUCTIVE_DAY_CLASSIFICATION","reason_codes":["RC-PRODUCTIVE","RC-NONPRODUCTIVE","RC-PLANNED-REST"],"rounding":{"apply_at":"STEP_OUTPUT","decimal_places":12,"mode":"ROUND_HALF_EVEN"},"state_read_timing":"BEFORE","state_write_timing":"NONE","step_id":"S11-PRODUCTIVE-DAY"},{"candidate_dimension":"STREAK_PLANNED_REST","fail_closed_reason":"FAIL_CLOSED_STREAK","input_type":"PRODUCTIVE_DAY_CLASSIFICATION","missing_data_behavior":"FAIL_CLOSED_STREAK","ordinal":12,"output_type":"STREAK_STATE","reason_codes":["RC-STREAK-GROW","RC-STREAK-PRESERVE","RC-STREAK-RESET"],"rounding":{"apply_at":"STEP_OUTPUT","decimal_places":12,"mode":"ROUND_HALF_EVEN"},"state_read_timing":"BEFORE","state_write_timing":"AFTER","step_id":"S12-STREAK-REST"},{"candidate_dimension":"MOMENTUM","fail_closed_reason":"FAIL_CLOSED_MOMENTUM","input_type":"PRODUCTIVE_DAY_CLASSIFICATION","missing_data_behavior":"FAIL_CLOSED_MOMENTUM","ordinal":13,"output_type":"MOMENTUM_STATE","reason_codes":["RC-MOMENTUM-UPDATE","RC-MOMENTUM-REST-HOLD"],"rounding":{"apply_at":"STEP_OUTPUT","decimal_places":12,"mode":"ROUND_HALF_EVEN"},"state_read_timing":"BEFORE","state_write_timing":"AFTER","step_id":"S13-MOMENTUM"},{"candidate_dimension":"RECOVERY","fail_closed_reason":"FAIL_CLOSED_RECOVERY","input_type":"PRODUCTIVE_DAY_CLASSIFICATION","missing_data_behavior":"FAIL_CLOSED_RECOVERY","ordinal":14,"output_type":"RECOVERY_STATE","reason_codes":["RC-RECOVERY-UPDATE"],"rounding":{"apply_at":"STEP_OUTPUT","decimal_places":12,"mode":"ROUND_HALF_EVEN"},"state_read_timing":"BEFORE","state_write_timing":"AFTER","step_id":"S14-RECOVERY"},{"candidate_dimension":"NONE","fail_closed_reason":"FAIL_CLOSED_ACCUMULATION","input_type":"FINAL_DAILY_CONTRIBUTION","missing_data_behavior":"FAIL_CLOSED_ACCUMULATION","ordinal":15,"output_type":"CUMULATIVE_NPU","reason_codes":["RC-NPU-ACCUMULATED"],"rounding":{"apply_at":"STEP_OUTPUT","decimal_places":12,"mode":"ROUND_HALF_EVEN"},"state_read_timing":"BEFORE","state_write_timing":"AFTER","step_id":"S15-CUMULATIVE-PROGRESSION"},{"candidate_dimension":"LEVEL_CURVE","fail_closed_reason":"FAIL_CLOSED_LEVEL","input_type":"CUMULATIVE_NPU","missing_data_behavior":"FAIL_CLOSED_LEVEL","ordinal":16,"output_type":"LEVEL_STATE","reason_codes":["RC-LEVEL-MAPPED"],"rounding":{"apply_at":"STEP_OUTPUT","decimal_places":12,"mode":"ROUND_HALF_EVEN"},"state_read_timing":"BEFORE","state_write_timing":"NONE","step_id":"S16-LEVEL-MAPPING"},{"candidate_dimension":"NONE","fail_closed_reason":"FAIL_CLOSED_EXPLANATION","input_type":"ALL_INTERMEDIATE_RECORDS","missing_data_behavior":"FAIL_CLOSED_EXPLANATION","ordinal":17,"output_type":"EXPLANATION_RECORD","reason_codes":["RC-EXPLANATION-COMPLETE"],"rounding":{"apply_at":"STEP_OUTPUT","decimal_places":12,"mode":"ROUND_HALF_EVEN"},"state_read_timing":"AFTER","state_write_timing":"NONE","step_id":"S17-EXPLANATION-EMISSION"}],"uncertainty_state_machine":{"affected_component":"POSITIVE_CONTEXT","bonus_multiplier_allowed":false,"debt_allowed":false,"evidence_window":{"invalid_signal_behavior":"REJECT","kind":"TRAILING_EVENT_COUNT","missing_signal_behavior":"HOLD_CURRENT_STATE_AND_USE_CURRENT_STATE_MULTIPLIER","size":3},"initial_state":"NORMAL","past_progression_mutation":false,"signals":["NORMAL","ISOLATED_ANOMALY","CONFLICT","MISSING"],"states":["NORMAL","WATCH","RESTRICTED","RECOVERING"],"transition_table":[{"applied_multiplier":1.0,"current_state":"NORMAL","missing_evidence_behavior":"HOLD_CURRENT_STATE_AND_USE_CURRENT_STATE_MULTIPLIER","multiplier_apply_timing":"AFTER_STATE_READ_BEFORE_STATE_WRITE","next_st